### ISSUE TITLE
[XML_RPC] Wrong output on one.image.lock

### ISSUE THREAD

**Issue by jaypif** [OpenNebula/one#3647]
**Description**
The output of `one.image.lock` do not respect what is indicated in the documentation. It leads to a "RESPONSE_ONE_PARSE" Error.
The object id is not return as "index 1" of the response while it should be

**To Reproduce**
call one.image.lock on an image
Answer:
` [RESPONSE_ONE_PARSE]: index 1: int or string expected`

Here is a tcp dump of the client / server exchange:

```
POST /RPC2 HTTP/1.1
Host: XXX:2633
User-Agent: Go-http-client/1.1
Content-Length: 270
Accept-Encoding: gzip

<?xml version="1.0" encoding="UTF-8"?><methodCall><methodName>one.image.lock</methodName><params><param><value><string>oneadmin:XXXXX</string></value></param><param><value><int>27</int></value></param><param><value><int>2</int></value></param></params></methodCall>HTTP/1.1 200 OK
Content-type: text/xml; charset=utf-8
Content-length: 261
Connection: Keep-Alive
Keep-Alive: timeout=15, max=30
Date: Wed, 04 Sep 2019 08:45:56 UTC
Server: Xmlrpc-c_Abyss/1.40.0

<?xml version="1.0" encoding="UTF-8"?>
<methodResponse>
<params>
<param><value><array><data>
<value><boolean>1</boolean></value>
*<value><boolean>1</boolean></value>*
<value><i4>0</i4></value>
</data></array></value></param>
</params>
</methodResponse>
```

**Expected behavior**

As you can see there is twice the boolean in response while it should be an integer (equal to 27 here)

The documentation says that is should be an integer: http://docs.opennebula.org/5.8/integration/system_interfaces/api.html?highlight=lock#one-image-lock

**Details**
 - Affected Component: XML_RPC
 - Version: 5.8.3

**Additional context**
Maybe other "lock" calls are impacted

## Progress Status
- [ ] Branch created 
- [ ] Code committed to development branch
- [ ] Testing - QA
- [ ] Documentation 
- [ ] Release notes - resolved issues, compatibility, known issues
- [ ] Code committed to upstream release/hotfix branches
- [ ] Documentation committed to upstream release/hotfix branches

**Comment by paczerny** [comment]
I wasn't able to reproduce. Tried version 5.8.3, 5.8.5 and master.

Is there any chance that the response doesn't belong to the one.image.lock request? Could it be response to one.vmpool.calculateshowback? Fix of issue #3174 is included in current release 5.8.5

**Comment by jaypif** [comment]
Hi @paczerny 

Thanks for the time spent on it.
I do not call showback functions so it is not related in my case.

I just wanted to lock an image with another value than "ALL". I cannot doing the test via Sunstone as "lock" function locks an image in "ALL" mode.

I will retry in 5.8.4 if I have the issue, It is on a production cluster so we did not plan to upgrade in 5.8.5 in the coming days.

**Comment by christian7007** [comment]
Hello @jaypif and @paczerny ,

This issue was solved here: https://github.com/OpenNebula/one/pull/2894

I've been testing it with the ruby binding:

```
[3] pry(main)> answer = @client.call("image.lock", 0, 4)
=> [true, 0, 0]
[4] pry(main)> answer[1].class
=> Integer
```

And tcpdump:

```
Frame 100: 317 bytes on wire (2536 bits), 317 bytes captured (2536 bits) on interface 0
Ethernet II, Src: 00:00:00_00:00:00 (00:00:00:00:00:00), Dst: 00:00:00_00:00:00 (00:00:00:00:00:00)
Internet Protocol Version 4, Src: 127.0.0.1, Dst: 127.0.0.1
Transmission Control Protocol, Src Port: 2633, Dst Port: 35576, Seq: 168, Ack: 456, Len: 251
[8 Reassembled TCP Segments (418 bytes): #86(17), #88(39), #90(21), #92(19), #94(37), #96(32), #98(2), #100(251)]
Hypertext Transfer Protocol
eXtensible Markup Language
    <?xml
        version="1.0"
        encoding="UTF-8"
        ?>
    <methodResponse>
        <params>
            <param>
                <value>
                    <array>
                        <data>
                            <value>
                                <boolean>
                                    1
                                    </boolean>
                                </value>
                            <value>
                                <i4>
                                    0
                                    </i4>
                                </value>
                            <value>
                                <i4>
                                    0
                                    </i4>
                                </value>
                            </data>
                        </array>
                    </value>
                </param>
            </params>
        </methodResponse>
```
And everything seems correct. 

Can you confirm that you are performing the request to an OpenNebula with a version greater or equal than 5.8.0?

**Comment by jaypif** [comment]
Hi

OK I close this one because I have a doubt about the release. I thought it was 5.8.3 but maybe it was 5.6.

Sorry about that issue.

Regards
