### ISSUE TITLE
Specify OVS uplink in a bond

### ISSUE THREAD

**Issue by tinova** [OpenNebula/one#7618]
**Description**

OpenvSwitch allows setting specific ports to output directly to a physical interface instead of the bond. For example like:

      ovs-ofctl add-flow br0 "in_port=5,actions=output:eth1"

We need to expose this functionality-

## Progress Status
- [ ] Code committed
- [ ] Testing - QA
- [ ] Documentation (Release notes - resolved issues, compatibility, known issues)

**Comment by dsatlawa** [comment]
The case might be a bit more complex than it looks. It depends whether OVS has bond or two separate NICs attached, but in general setting egress flow might not cover edge cases. The danger is traffic returning the other leg. That may potentially cause network instability, MAC flapping, assymetric routing and others. 

One way is to manually "disable" the other path for this flow. It's not the only approach of course but one to consider. This one uses MAC-based flow instead of port-based to make it more portable. In case of the VM migration, the same setup (I mean commands - the "preparation package" can be scripted and stored somewhere in VM properties). I think also port-based and vNIC-name-based approaches are worth considering for pros and cons.

Of course, here the ingress traffic through the "bad" link will hit hard drop. I assume timeout and retransmit in such case to the "good" one but I am not sure if such behavior is acceptably reliable - need advise.

For demonstrative purposes we assume following values. Adjust to your needs. We assume that host has two uplinks: eth0 and eth1, while we want to restrict VM to use only eth1.

a) Physical switch name SW1, linked to eth1 on hypervisor host. Hence, eth1 = uplink.
b) VM vNIC name: vnic1
c) VM vNIC MAC: AA:BB:CC:DD:EE:FF
d) OVS bridge name: br0

1. Log in to hypervisor host and start a root CLI session
2. Define OVS flows accordingly:

a) define egress flow (VM -> outside) to use particular uplink
`ovs-ofctl add-flow br0 "priority=200,dl_src=AA:BB:CC:DD:EE:FF,actions=output:eth1"
`
b) define ingress flow (outside -> VM) to perform MAC learning on allowed path:
`ovs-ofctl add-flow br0 "priority=200,in_port=eth1,dl_dst=AA:BB:CC:DD:EE:FF,actions=NORMAL"
`
c) block traffic on banned path 
`ovs-ofctl add-flow br0 "priority=300,in_port=eth0,dl_dst=AA:BB:CC:DD:EE:FF,actions=drop"
`
d) verify if flows installed correctly:
`ovs-ofctl dump-flows br0
`

**Comment by dann1** [comment]
SLB hash traffic tracking

Identify $iface wanted to be tracked (one-$vm_id-$nic_id) or internal interfaces like ovsbr0
Get $mac address of said iface ip link show $iface
Get slb bond bucket ovs-appctl bond/hash $mac $vlan
See bucket distribution per bond member in ovs-appctl bond/show bond0
Example
Using two internal interfaces serving ICMP requests
[root@rhel9-1013 ~]# ovs-vsctl show
ed379305-0dbf-4c3f-bca5-396ba0aaea58
Bridge ovsbr0
Port ovsbr0
Interface ovsbr0
type: internal
Port internal2
Interface internal2
type: internal
Port bond0
Interface eth1
Interface eth2
ovs_version: "3.6.0-12.el9fdp"
[root@rhel9-1013 ~]# ip addr show internal2
27: internal2: <BROADCAST,MULTICAST,UP,LOWER_UP> mtu 1500 qdisc noqueue state UNKNOWN group default qlen 1000
link/ether aa:82:95:8a:a4:f1 brd ff:ff:ff:ff:ff:ff
inet 192.168.150.111/24 scope global internal2
valid_lft forever preferred_lft forever
[root@rhel9-1013 ~]# ip addr show ovsbr0
26: ovsbr0: <BROADCAST,MULTICAST,UP,LOWER_UP> mtu 9000 qdisc noqueue state UNKNOWN group default qlen 1000
link/ether 92:af:0b:26:bd:43 brd ff:ff:ff:ff:ff:ff
inet 192.168.151.13/24 scope global ovsbr0
valid_lft forever preferred_lft forever
mac1="aa:82:95:8a:a4:f1"
mac2="92:af:0b:26:bd:43"
[root@rhel9-1013 ~]# ovs-appctl bond/hash $mac1
10
[root@rhel9-1013 ~]# ovs-appctl bond/hash $mac2
115
[root@rhel9-1013 ~]# tcpdump -i any icmp
tcpdump: data link type LINUX_SLL2
dropped privs to tcpdump
tcpdump: verbose output suppressed, use -v[v]... for full protocol decode
listening on any, link-type LINUX_SLL2 (Linux cooked v2), snapshot length 262144 bytes
11:56:46.123111 eth1 P IP 192.168.151.2 > rhel9-1013: ICMP echo request, id 23, seq 168, length 1119
11:56:46.123121 ovsbr0 In IP 192.168.151.2 > rhel9-1013: ICMP echo request, id 23, seq 168, length 1119
11:56:46.123144 ovsbr0 Out IP rhel9-1013 > 192.168.151.2: ICMP echo reply, id 23, seq 168, length 1119
11:56:46.123147 eth1 Out IP rhel9-1013 > 192.168.151.2: ICMP echo reply, id 23, seq 168, length 1119
11:56:46.507144 eth2 P IP rsyslog_collector > rhel9-1013: ICMP echo request, id 18, seq 506, length 1119
11:56:46.507151 internal2 In IP rsyslog_collector > rhel9-1013: ICMP echo request, id 18, seq 506, length 1119
11:56:46.507170 internal2 Out IP rhel9-1013 > rsyslog_collector: ICMP echo reply, id 18, seq 506, length 1119
11:56:46.507173 eth2 Out IP rhel9-1013 > rsyslog_collector: ICMP echo reply, id 18, seq 506, length 1119
11:56:47.147130 eth1 P IP 192.168.151.2 > rhel9-1013: ICMP echo request, id 23, seq 169, length 1119
11:56:47.147140 ovsbr0 In IP 192.168.151.2 > rhel9-1013: ICMP echo request, id 23, seq 169, length 1119
11:56:47.147167 ovsbr0 Out IP rhel9-1013 > 192.168.151.2: ICMP echo reply, id 23, seq 169, length 1119
11:56:47.147261 eth1 Out IP rhel9-1013 > 192.168.151.2: ICMP echo reply, id 23, seq 169, length 1119
11:56:47.531062 eth2 P IP rsyslog_collector > rhel9-1013: ICMP echo request, id 18, seq 507, length 1119
11:56:47.531070 internal2 In IP rsyslog_collector > rhel9-1013: ICMP echo request, id 18, seq 507, length 1119
11:56:47.531089 internal2 Out IP rhel9-1013 > rsyslog_collector: ICMP echo reply, id 18, seq 507, length 1119
11:56:47.531091 eth2 Out IP rhel9-1013 > rsyslog_collector: ICMP echo reply, id 18, seq 507, length 1119
11:56:48.170917 eth1 P IP 192.168.151.2 > rhel9-1013: ICMP echo request, id 23, seq 170, length 1119
11:56:48.170924 ovsbr0 In IP 192.168.151.2 > rhel9-1013: ICMP echo request, id 23, seq 170, length 1119
11:56:48.170943 ovsbr0 Out IP rhel9-1013 > 192.168.151.2: ICMP echo reply, id 23, seq 170, length 1119
11:56:48.170946 eth1 Out IP rhel9-1013 > 192.168.151.2: ICMP echo reply, id 23, seq 170, length 1119
11:56:48.554862 eth2 P IP rsyslog_collector > rhel9-1013: ICMP echo request, id 18, seq 508, length 1119
11:56:48.554870 internal2 In IP rsyslog_collector > rhel9-1013: ICMP echo request, id 18, seq 508, length 1119
11:56:48.554889 internal2 Out IP rhel9-1013 > rsyslog_collector: ICMP echo reply, id 18, seq 508, length 1119
11:56:48.554892 eth2 Out IP rhel9-1013 > rsyslog_collector: ICMP echo reply, id 18, seq 508, length 1119
[root@rhel9-1013 ~]# ovs-appctl bond/show bond0
---- bond0 ----
bond_mode: balance-slb
bond may use recirculation: no, Recirc-ID : -1
bond-hash-basis: 0
lb_output action: disabled, bond-id: -1
all members active: false
updelay: 0 ms
downdelay: 0 ms
next rebalance: 3469 ms
lacp_status: off
lacp_fallback_ab: false
active-backup primary:
active member mac: 02:00:d8:27:21:84(eth1)
member eth1: enabled
active member
may_enable: true
hash 115: 17 kB load
member eth2: enabled
may_enable: true
hash 10: 18 kB load
